{
  "schema_version": "0.3.0",
  "document_type": "alarm_definitions",
  "generated_at": "2026-08-07T00:00:00Z",
  "source_document": "Homestead_Digital_Twin_Software_Design_Document_v0.3.md",
  "registry_basis": "homestead.primary.v0_3",
  "severities": {
    "info": "Expected state change or advisory.",
    "warning": "Attention required but no immediate loss of function.",
    "major": "Subsystem degraded or resource at risk.",
    "critical": "Immediate action required to prevent major damage or loss of essential service.",
    "emergency": "Life-safety or rapidly escalating physical hazard. Local alarms and protective actions execute independently of this platform (SDD 14.1). The platform reports; it is not the safety system."
  },
  "lifecycle_states": [
    "detected",
    "active",
    "acknowledged",
    "mitigated",
    "cleared",
    "reviewed"
  ],
  "maintenance_mode_behaviours": {
    "suppress": "Alarm is still evaluated and recorded, but notification is withheld while the scope is in maintenance.",
    "downgrade": "Alarm is recorded and notified one severity step lower while the scope is in maintenance.",
    "notify_only": "Alarm notifies normally in maintenance; used where withholding an alert would be unsafe.",
    "normal": "Maintenance mode has no effect on this alarm."
  },
  "threshold_statuses": {
    "derived_from_design_document": "The value is computed from a figure that the v0.3 design package actually states (for example the 10 kW hybrid-inverter rating).",
    "commissioning_default": "A defensible starting value chosen so the alarm can be exercised on the bench. It is NOT a decided setpoint. It must be reviewed and replaced during the SDD section 19 commissioning sequence before it governs a real asset.",
    "not_applicable": "The alarm has no numeric threshold (boolean, enumerated or quality driven)."
  },
  "trigger_operators": {
    "lt": "Numeric less-than.",
    "le": "Numeric less-than-or-equal.",
    "gt": "Numeric greater-than.",
    "ge": "Numeric greater-than-or-equal.",
    "eq": "Equality, including booleans and enumerations.",
    "ne": "Inequality.",
    "in": "Current value is a member of the listed set.",
    "not_in": "Current value is not a member of the listed set.",
    "quality_in": "Quality-driven trigger. Used only by data-quality alarms, which are raised by the evaluator when a process alarm's input is bad or stale (SDD 26.6). A process alarm must never trigger on bad or stale data."
  },
  "notification_channels": {
    "log": "Always available. Writes a notification-log record and a platform log line.",
    "email": "SDD FR-007. Not configured in v0.3 -- records a \"not_configured\" delivery row.",
    "push": "SDD FR-007. Not configured in v0.3 -- records a \"not_configured\" delivery row.",
    "voice": "SDD FR-007 CUCM/voice escalation for critical events. Not configured in v0.3 -- records a \"not_configured\" delivery row. Never claim a voice call was placed."
  },
  "parent_scopes": {
    "same_asset": "The parent alarm must be open on the same asset.",
    "related": "The parent alarm must be open on an asset connected to this one in the registry relationship graph.",
    "any": "Any open instance of the parent alarm qualifies."
  },
  "correlation_defaults": {
    "window_s": 900,
    "flood_threshold": 5,
    "max_graph_depth": 8,
    "downstream_edge_types": {
      "feeds": "forward",
      "contains": "forward",
      "hosts": "forward",
      "controls": "forward",
      "serves": "forward",
      "protects": "forward",
      "located_in": "reverse",
      "part_of": "reverse",
      "depends_on": "reverse",
      "managed_by": "reverse",
      "powered_by": "reverse"
    },
    "notes": [
      "A power-container outage must produce one incident with many member alarms, not hundreds of independent notifications (SDD 14.2). Correlation walks the registry relationship graph; it is not a hard-coded list of alarm keys.",
      "The register currently declares no depends_on edges. The graph walk supports the type so that dependencies added later correlate without a code change."
    ]
  },
  "open_items": [
    {
      "id": "energy.capacity_revision",
      "description": "Battery capacity is unresolved between the revised 800 kWh nominal / 640 kWh usable target and the 240 kWh predecessor design (register design_basis.open_design_conflicts). Every kWh-denominated threshold below is expressed against the 640 kWh usable figure and must be recomputed once the conflict is closed.",
      "affects": [
        "battery_reserve_critical"
      ]
    },
    {
      "id": "battery.chemistry_unresolved",
      "description": "Battery chemistry, module count and nominal DC voltage are open_fields on energy.battery_bank.power_container.01. Cell temperature and cell-imbalance limits are therefore generic placeholders and must be replaced by the limits the selected BMS publishes.",
      "affects": [
        "battery_temperature_high",
        "battery_cell_imbalance"
      ]
    },
    {
      "id": "generator.design_unresolved",
      "description": "Generator fuel type, tank size, rated power and transfer architecture are open_fields on energy.generator.site.01. The fuel-level thresholds are placeholders and cannot be converted into a run-time reserve until the fuel system is specified.",
      "affects": [
        "generator_fuel_low"
      ]
    },
    {
      "id": "loads.unmeasured",
      "description": "Rack, cooling, greenhouse, spa, workshop and pump loads have never been measured (README \"Deliberately unresolved\"). Load-derived thresholds are planning placeholders only.",
      "affects": [
        "critical_load_growth",
        "ups_runtime_low",
        "inverter_overload_risk"
      ]
    },
    {
      "id": "container.cooling_unresolved",
      "description": "SDD section 22 item 12 leaves the container's physical separation and independent cooling strategy undecided, so the power/battery/server zone temperature limits are conservative placeholders rather than design values.",
      "affects": [
        "power_container_cooling_failed",
        "server_zone_temperature_high"
      ]
    },
    {
      "id": "pv.performance_model_missing",
      "description": "SDD 37.1 requires irradiance-normalised PV underperformance detection. No performance model exists yet, and final stringing and MPPT allocation are unresolved, so the shipped rule is a crude irradiance-gated floor.",
      "affects": [
        "pv_generation_underperformance"
      ]
    },
    {
      "id": "procedures.not_written",
      "description": "SDD FR-008 requires every alarm to link to an operating procedure. No procedure library exists in this repository yet. Every procedure_ref below is a stable identifier reserved for that procedure, and every definition carries procedure_status \"not_yet_written\".",
      "affects": []
    }
  ],
  "alarms": [
    {
      "alarm_key": "battery_soc_low",
      "name": "Battery state of charge low",
      "severity": "warning",
      "domain": "energy",
      "asset_id": "energy.battery_bank.power_container.01",
      "point_name": "soc_pct",
      "trigger": {
        "operator": "lt",
        "value": 40
      },
      "reset": {
        "operator": "ge",
        "value": 45
      },
      "hysteresis": 5,
      "on_delay_s": 300,
      "off_delay_s": 600,
      "trigger_expression": "soc_pct < 40 % held 300 s; clears at soc_pct >= 45 % held 600 s",
      "threshold_status": "commissioning_default",
      "threshold_basis": "SDD 30.8 qualifies CONSERVE on \"SOC below the normal reserve target\". The normal reserve target is not decided (SDD 22 item 1), so 40 % entry / 45 % recovery is a bench default with a deliberate 5-point deadband.",
      "requires_manual_reset": false,
      "maintenance_mode_behaviour": "suppress",
      "parent_alarm_key": null,
      "parent_scope": "related",
      "data_quality_alarm_key": "energy_meter_data_invalid",
      "affected_assets": [
        "energy.battery_bank.power_container.01",
        "energy.bms.power_container.01",
        "energy.panel.power_container.critical_01"
      ],
      "probable_causes": [
        "Extended low-irradiance period with no generator support.",
        "Discretionary load left running through the overnight discharge window.",
        "PV array or inverter underproduction.",
        "State-of-charge estimate drift after a period without a full charge cycle."
      ],
      "automatic_action": "None from this platform at warning severity. The EMS may independently enter CONSERVE and shed tier 4 loads under SDD 32; that decision belongs to the EMS, not the alarm engine.",
      "operator_action": "Confirm forecast energy margin, review discretionary loads, and decide whether to request generator support before reserve reaches the critical margin.",
      "procedure_ref": "OP-ENERGY-LOW-SOC",
      "procedure_status": "not_yet_written",
      "escalation_path": [
        {
          "stage": 1,
          "after_s": 0,
          "channels": [
            "log"
          ],
          "role": "operator"
        },
        {
          "stage": 2,
          "after_s": 3600,
          "channels": [
            "email"
          ],
          "role": "operator"
        }
      ],
      "renotify_after_s": 0,
      "suppression_conditions": [
        {
          "type": "operating_mode",
          "scope": "asset",
          "modes": [
            "maintenance",
            "off"
          ],
          "description": "Battery bank under maintenance or intentionally unavailable."
        },
        {
          "type": "manual",
          "description": "Suppressed during a commissioning discharge test (SDD 39)."
        }
      ],
      "correlation": {
        "window_s": 900,
        "flood_threshold": 3
      },
      "source_sections": [
        "37.1",
        "30.8",
        "30.9"
      ],
      "enabled": true,
      "notes": [